{
  "schema_version": "0.1.0",
  "taxonomy_version": "0.1.0",
  "track": {
    "track_id": "youtube:k9wl9993ukE",
    "artist": "Example Artist",
    "title": "Example Track",
    "album": null,
    "release_date": null,
    "duration_seconds": 240,
    "bpm": 142,
    "youtube_video_id": "k9wl9993ukE"
  },
  "evidence": [
    {
      "id": "e1",
      "source": "source_a",
      "type": "style",
      "claim": "Melodic Dubstep",
      "source_item_id": null,
      "source_url": null,
      "independence_group": "source_a",
      "reliability": "high"
    },
    {
      "id": "e2",
      "source": "source_b",
      "type": "editorial",
      "claim": "Emotional, cinematic dubstep with vocal-led melodic breakdowns.",
      "source_item_id": null,
      "source_url": null,
      "independence_group": "source_b",
      "reliability": "medium"
    }
  ]
}
